{
  "$schema": "https://json-schema.org/draft/2020-12/schema",
  "title": "E.ROIs v2.0",
  "type": "object",
  "required": ["contract", "schema_version", "artifact_id", "case_id", "producer", "payload"],
  "additionalProperties": false,
  "properties": {
    "contract": {"const": "E.ROIs"},
    "schema_version": {"const": "2.0"},
    "artifact_id": {"type": "string", "minLength": 1},
    "case_id": {"type": "string", "minLength": 1},
    "producer": {"type": "string", "minLength": 1},
    "payload": {"$ref": "metadata_case_payload.schema.json#/$defs/roiPayload"}
  }
}
